{
  "workflow": "paternity_nyc",
  "workflow_category": "family_court",
  "issue_type": "paternity",
  "court": "family_court",
  "counties_supported": ["New York", "Kings", "Queens", "Bronx", "Richmond"],
  "description": "Family Court proceeding to establish paternity of a child, which may lead to custody, visitation, and child support orders.",
  "triggers": [
    "paternity",
    "establish father",
    "acknowledgment of paternity",
    "who is the father",
    "DNA test"
  ],
  "entry_questions": [
    "Are you trying to establish who the legal father of a child is?",
    "Is there an active divorce case?"
  ],
  "routing_rules": [],
  "routing_priority": 40,
  "intake_priority": 40,
  "entry_conditions": [
    "User seeks to establish legal paternity of a child",
    "Case is commenced in NYC Family Court",
    "No existing acknowledgment of paternity resolves parentage"
  ],
  "required_fields": [
    { "key": "county", "type": "string", "required": true, "question": "In which NYC county are you filing?" },
    { "key": "child_name", "type": "string", "required": true, "question": "What is the full name of the child?" },
    { "key": "child_birth_date", "type": "date", "required": true, "question": "What is the child's date of birth?" },
    { "key": "petitioner_information", "type": "string", "required": true, "question": "What is your full legal name and contact information?" },
    { "key": "respondent_information", "type": "string", "required": true, "question": "What is the alleged father's full legal name and contact information?" },
    { "key": "mother_information", "type": "string", "required": true, "question": "What is the mother's full legal name and contact information?" }
  ],
  "stages": [
    "petition",
    "service",
    "hearing",
    "genetic_testing",
    "order"
  ],
  "workflow_outcomes": [
    "order_of_filiation",
    "paternity_establishment"
  ],
  "required_forms": [
    {
      "stage": "petition",
      "forms": [
        { "code": "5-1", "internal_code": null, "title": "Petition for Paternity" }
      ]
    }
  ],
  "optional_forms": [],
  "supporting_documents": [
    "birth_certificate",
    "acknowledgment_of_paternity",
    "genetic_testing_results"
  ],
  "includes": ["child_support"],
  "internal": {
    "workflow_enum": "PATERNITY",
    "node_sequence": [
      "NODE_3001_SUPPORT_PETITION",
      "NODE_3002_SUPPORT_ORDER"
    ],
    "progression": [
      { "node": "NODE_3001_SUPPORT_PETITION" },
      { "node": "NODE_3002_SUPPORT_ORDER", "condition": { "kind": "event", "value": "JUDGMENT_ENTERED" } }
    ]
  },
  "source_references": [
    "https://www.nycourts.gov/family-forms",
    "https://familylegalcare.org/courtforms/"
  ]
}
