{
  "workflow": "visitation_nyc",
  "workflow_category": "family_court",
  "issue_type": "visitation",
  "court": "family_court",
  "counties_supported": ["New York", "Kings", "Queens", "Bronx", "Richmond"],
  "description": "Family Court proceeding to establish or modify visitation (parenting time) with a minor child in NYC.",
  "triggers": [
    "visitation",
    "parenting time",
    "access",
    "see my child",
    "visitation schedule"
  ],
  "entry_questions": [
    "Are you seeking visitation or parenting time with a child?",
    "Is there an active divorce case?"
  ],
  "routing_rules": [
    {
      "condition": "active_divorce=true",
      "workflow": "uncontested_divorce_children_nyc"
    },
    {
      "condition": "active_divorce=contested",
      "workflow": "contested_divorce_nyc"
    }
  ],
  "routing_priority": 45,
  "intake_priority": 45,
  "entry_conditions": [
    "User is seeking visitation or parenting time with a child",
    "No active divorce workflow controls visitation",
    "Case is commenced in NYC Family Court"
  ],
  "required_fields": [
    { "key": "county", "type": "string", "required": true, "question": "In which NYC county are you filing?" },
    { "key": "child_count", "type": "integer", "required": true, "question": "How many children are involved?" },
    { "key": "child_names", "type": "array", "required": true, "question": "What are the full names of the children?" },
    { "key": "petitioner_information", "type": "string", "required": true, "question": "What is your full legal name and contact information?" },
    { "key": "respondent_information", "type": "string", "required": true, "question": "What is the other parent's full legal name and contact information?" },
    { "key": "proposed_visitation_schedule", "type": "string", "required": false, "question": "What visitation or parenting time schedule are you requesting?" },
    { "key": "existing_orders", "type": "array", "required": false, "question": "Are there any existing custody or visitation orders?" }
  ],
  "stages": [
    "petition",
    "service",
    "hearing",
    "order",
    "modification",
    "violation",
    "enforcement"
  ],
  "workflow_outcomes": [
    "visitation_order"
  ],
  "required_forms": [
    {
      "stage": "petition",
      "forms": [
        { "code": "GF-17", "internal_code": "FC-1", "title": "Petition for Custody and/or Visitation" }
      ]
    },
    {
      "stage": "modification",
      "forms": [
        { "code": "GF-40", "internal_code": null, "title": "Petition for Modification of Custody/Visitation Order" }
      ]
    },
    {
      "stage": "violation",
      "forms": [
        { "code": "GF-41", "internal_code": null, "title": "Petition for Violation of Custody/Visitation Order" }
      ]
    },
    {
      "stage": "enforcement",
      "forms": [
        { "code": "GF-41", "internal_code": null, "title": "Petition for Violation of Custody/Visitation Order" }
      ]
    }
  ],
  "optional_forms": [],
  "supporting_documents": [
    "birth_certificates",
    "existing_court_orders",
    "parenting_plan"
  ],
  "includes": [],
  "internal": {
    "workflow_enum": "VISITATION",
    "node_sequence": [
      "NODE_2001_CUSTODY_PETITION",
      "NODE_2002_CUSTODY_HEARING",
      "NODE_2003_CUSTODY_ORDER"
    ],
    "progression": [
      { "node": "NODE_2001_CUSTODY_PETITION" },
      { "node": "NODE_2002_CUSTODY_HEARING", "condition": { "kind": "event", "value": "HEARING_SCHEDULED" } },
      { "node": "NODE_2003_CUSTODY_ORDER", "condition": { "kind": "event", "value": "JUDGMENT_ENTERED" } }
    ]
  },
  "source_references": [
    "https://www.nycourts.gov/family-forms",
    "https://familylegalcare.org/courtforms/"
  ]
}
