{
  "workflow": "uncontested_divorce_no_children_nyc",
  "workflow_category": "divorce",
  "issue_type": "divorce",
  "court": "supreme_court",
  "counties_supported": ["New York", "Kings", "Queens", "Bronx", "Richmond"],
  "description": "Uncontested matrimonial action in NYC Supreme Court where both parties agree to divorce and there are no minor children under 21.",
  "triggers": [
    "divorce",
    "uncontested divorce",
    "agreed divorce",
    "we both agree",
    "divorce without children",
    "no children divorce"
  ],
  "entry_questions": [
    "Do you want a divorce?",
    "Does your spouse agree to the divorce?",
    "Do you have any children under 21?"
  ],
  "routing_rules": [],
  "routing_priority": 90,
  "intake_priority": 90,
  "entry_conditions": [
    "User seeks a divorce in NYC",
    "Both parties agree to the divorce",
    "No minor children under 21",
    "Matrimonial action is uncontested"
  ],
  "required_fields": [
    { "key": "county", "type": "string", "required": true, "question": "In which NYC county are you filing?" },
    { "key": "marriage_date", "type": "date", "required": true, "question": "On what date were you married?" },
    { "key": "separation_date", "type": "date", "required": true, "question": "On what date did you and your spouse separate?" },
    { "key": "grounds_for_divorce", "type": "string", "required": true, "question": "What are your grounds for divorce?" },
    { "key": "plaintiff_information", "type": "string", "required": true, "question": "What is your full legal name and contact information?" },
    { "key": "defendant_information", "type": "string", "required": true, "question": "What is your spouse's full legal name and contact information?" },
    { "key": "has_minor_children", "type": "boolean", "required": true, "question": "Do you have any children under 21 with your spouse?" },
    { "key": "marital_property_resolved", "type": "boolean", "required": true, "question": "Have you and your spouse resolved all marital property and debt issues?" }
  ],
  "stages": [
    "commencement",
    "service",
    "calendar",
    "judgment"
  ],
  "workflow_outcomes": [
    "judgment_of_divorce",
    "property_division_terms"
  ],
  "required_forms": [
    {
      "stage": "commencement",
      "forms": [
        { "code": "UD-1", "internal_code": "UD-1", "title": "Summons With Notice" },
        { "code": "UD-2", "internal_code": "UD-2", "title": "Verified Complaint" }
      ]
    },
    {
      "stage": "service",
      "forms": [
        { "code": "UD-3", "internal_code": "UD-3", "title": "Affirmation of Service" }
      ]
    },
    {
      "stage": "calendar",
      "forms": [
        { "code": "UD-4", "internal_code": "UD-4", "title": "Sworn Statement of Removal of Barriers to Remarriage" },
        { "code": "UD-5", "internal_code": "UD-5", "title": "Affirmation of Regularity" },
        { "code": "UD-6", "internal_code": "UD-6", "title": "Sworn Affirmation of Plaintiff" },
        { "code": "UD-7", "internal_code": "UD-7", "title": "Affirmation of Defendant" },
        { "code": "UD-9", "internal_code": null, "title": "Note of Issue" },
        { "code": "UD-10", "internal_code": null, "title": "Findings of Fact and Conclusions of Law" },
        { "code": "UD-12", "internal_code": "UD-12", "title": "Part 130 Certification" },
        { "code": "UD-13", "internal_code": "RJI", "title": "Request for Judicial Intervention" }
      ]
    },
    {
      "stage": "judgment",
      "forms": [
        { "code": "UD-11", "internal_code": null, "title": "Judgment of Divorce" },
        { "code": "UD-14", "internal_code": null, "title": "Notice of Entry" }
      ]
    }
  ],
  "optional_forms": [
    {
      "stage": "commencement",
      "forms": [
        { "code": "UD-1a", "internal_code": null, "title": "Summons (to be served with Verified Complaint)" },
        { "code": "AUTO-ORDERS", "internal_code": null, "title": "Notice of Automatic Orders" }
      ]
    }
  ],
  "supporting_documents": [
    "marriage_certificate",
    "proof_of_residency",
    "separation_agreement_or_stipulation",
    "financial_disclosures",
    "statement_of_net_worth"
  ],
  "includes": ["property_division"],
  "internal": {
    "workflow_enum": "UNCONTESTED_DIVORCE_NO_CHILDREN",
    "workflow_enum_base": "UNCONTESTED_DIVORCE",
    "node_sequence": [
      "NODE_1001_DIVORCE_FILED",
      "NODE_1002_SERVICE_COMPLETE",
      "NODE_1010_JUDGMENT"
    ],
    "progression": [
      { "node": "NODE_1001_DIVORCE_FILED" },
      { "node": "NODE_1002_SERVICE_COMPLETE", "condition": { "kind": "event", "value": "SERVICE_COMPLETED" } },
      { "node": "NODE_1010_JUDGMENT", "condition": { "kind": "package", "value": "PKG_JUDGMENT" } }
    ]
  },
  "source_references": [
    "https://www.nycourts.gov/courthelp/family/divorceStarting.shtml",
    "https://www.nycourts.gov/divorce/divorce_withchildrenunder21.shtml",
    "https://www.nycourts.gov/LegacyPDFS/divorce/COMPOSITE-UNCONTESTED-DIVORCE-FORMS.pdf"
  ]
}
